item_type,file,key_a,key_b,label,origin,source_db,source_ref,pmid,doi,nct_id,chembl_id,mesh_id,drugbank_id,source_url,source_title,source_journal_year,retrieved_on,query_used,evidence_level,verdict,verification,ref_url,note
drug_disease_label,associations/Kdataset.csv,67(DB01590),454(D064726),DB01590 → Triple Negative Breast Neoplasms,data-v2 (TNBC),ChEMBL drug_indication (mesh_id=D064726),ClinicalTrials.gov NCT05954442,,,NCT05954442,CHEMBL1908360,D064726,DB01590,https://www.ebi.ac.uk/chembl/compound_report_card/CHEMBL1908360/,Everolimus With Investigator's Choice of Chemotherapy in Advanced Triple-Negative Breast C,,2026-07-22,GET ebi.ac.uk/chembl/api/data/drug_indication?mesh_id=D064726 | GET clinicaltrials.gov/api/v2/studies?query.cond=triple+negative+breast+cancer&query.intr=everolimus,clinical_phase_2,SUPPORTED,PubChem PUG REST (ID) + ClinicalTrials.gov API v2 (交叉驗),https://clinicaltrials.gov/study/NCT05954442,[Evidence欄:ChEMBL-p2|NCT05954442] ChEMBL max_phase 2;CT.gov 20 個試驗
drug_disease_label,associations/Kdataset.csv,68(DB00571),454(D064726),DB00571 → Triple Negative Breast Neoplasms,data-v2 (TNBC),ChEMBL drug_indication (mesh_id=D064726),ClinicalTrials.gov NCT05741164,,,NCT05741164,CHEMBL27,D064726,DB00571,https://www.ebi.ac.uk/chembl/compound_report_card/CHEMBL27/,Propranolol and Pembrolizumab for Tumor Re-sensitization and Treatment of Patients With Ch,,2026-07-22,GET ebi.ac.uk/chembl/api/data/drug_indication?mesh_id=D064726 | GET clinicaltrials.gov/api/v2/studies?query.cond=triple+negative+breast+cancer&query.intr=propranolol,clinical_phase_2,SUPPORTED,PubChem PUG REST (ID) + ClinicalTrials.gov API v2 (交叉驗),https://clinicaltrials.gov/study/NCT05741164,[Evidence欄:ChEMBL-p2|NCT05741164] ChEMBL max_phase 2;CT.gov 1 個試驗
drug_disease_label,associations/Kdataset.csv,688(DB01206),463(D054198),lomustine → Precursor Cell Lymphoblastic Leukemia-Lymphoma,data-v1 (策展) → 稽核保留,"—(人工策展,原始無引用)",,,10.1111/j.1939-1676.1999.tb01452.x,,,D054198,DB01206,https://academic.oup.com/jvim/article/13/5/395/8452336,Lomustine (CCNU) for the Treatment of Resistant Lymphoma in Dogs,J Vet Intern Med 1999,2026-07-22,文獻稽核(agent 查 PubMed/獸醫指引),case_series,SUPPORTED,文獻稽核(pet_labels_provenance.csv),https://academic.oup.com/jvim/article/13/5/395/8452336,"[Evidence欄:標準] Real and accepted canine use but as a RESCUE agent for relapsed/resistant lymphoma (28% response), not first-line standard of care; no PMID surfaced i | 橋接:ANALOGOUS"
drug_disease_label,associations/Kdataset.csv,688(DB01206),502(D007946),"lomustine → Leukemia, Mast-Cell",data-v1 (策展) → 稽核保留,"—(人工策展,原始無引用)",,10587263,10.1892/0891-6640(1999)013<0601:tocmct>2.3.co;2,,,D007946,DB01206,https://pubmed.ncbi.nlm.nih.gov/10587263/,Treatment of canine mast cell tumors with CCNU (lomustine),J Vet Intern Med 1999,2026-07-22,文獻稽核(agent 查 PubMed/獸醫指引),case_series,SUPPORTED,文獻稽核(pet_labels_provenance.csv),https://pubmed.ncbi.nlm.nih.gov/10587263/,"[Evidence欄:標準] 42% measurable response; authors concluded CCNU 'should be considered an active agent' for canine MCT, and consensus protocols use CCNU alone or alter | 橋接:ANALOGOUS"
drug_disease_label,associations/Kdataset.csv,688(DB01206),459(D001932),lomustine → Brain Neoplasms,data-v1 (策展) → 稽核保留,"—(人工策展,原始無引用)",,,,,,D001932,DB01206,https://www.msdvetmanual.com/nervous-system/neoplasia-of-the-nervous-system/neoplasia-of-the-nervous-system-in-small-animals,Neoplasia of the Nervous System in Small Animals - MSD Veterinary Manual,,2026-07-22,文獻稽核(agent 查 PubMed/獸醫指引),guideline,SUPPORTED,文獻稽核(pet_labels_provenance.csv),https://www.msdvetmanual.com/nervous-system/neoplasia-of-the-nervous-system/neoplasia-of-the-nervous-system-in-small-animals,[Evidence欄:標準犬腦瘤] MSD Vet Manual: 'Addition of cytotoxic drugs (most commonly hydroxyurea or lomustine [CCNU]) postoperatively or at recurrence may lengthen survival ti | 橋接:EQUIVALENT
drug_disease_label,associations/Kdataset.csv,702(DB01097),461(D001172),"leflunomide → Arthritis, Rheumatoid",data-v1 (策展) → 稽核保留,"—(人工策展,原始無引用)",,20113244,10.2460/javma.236.3.312,,,D001172,DB01097,https://pmc.ncbi.nlm.nih.gov/articles/PMC3089001/,Efficacy of leflunomide for treatment of immune-mediated polyarthritis in dogs: 14 cases (2006-2008),J Am Vet Med Assoc 2010;236(3):312-318,2026-07-22,文獻稽核(agent 查 PubMed/獸醫指引),case_series,SUPPORTED,文獻稽核(pet_labels_provenance.csv),https://pubmed.ncbi.nlm.nih.gov/20113244/,"[Evidence欄:標準犬多關節炎] Merck Vet Manual states 'Leflunomide can also be used instead of steroids, with good results' and this case series showed 93% complete/partial respons | 橋接:ANALOGOUS"
drug_disease_label,associations/Kdataset.csv,73(DB01222),456(D001249),budesonide → Asthma,data-v3 (擴充),—(文獻/指引),Asthma in Cats: Management Guidelines (Today's Veterinary Practice),,,,,D001249,DB01222,https://todaysveterinarypractice.com/respiratory-medicine/asthma-in-cats-management-guidelines/,,Asthma in Cats: Management Guidelines (Today's Veterinary Practice),2026-07-22,PubMed/獸醫指引檢索(agent);PMID 經 eutils esummary 驗證,prospective_trial,SUPPORTED,NCBI E-utilities (PMID) + PubChem/PrimeKG (DrugBank ID),https://todaysveterinarypractice.com/respiratory-medicine/asthma-in-cats-management-guidelines/,"[Evidence欄:Asthma in Cats: Management G] A study of inhaled budesonide (400 ug q12h) in cats improved clinical signs and reduced airflow limitation, supporting it as an alternative inhaled co | 橋接:EQUIVALENT"
drug_disease_label,associations/Kdataset.csv,731(DB00361),465(D009101),melphalan → Multiple Myeloma,data-v1 (策展) → 稽核保留,"—(人工策展,原始無引用)",,29566439,10.1111/jvim.15084,,,D009101,DB00361,https://pubmed.ncbi.nlm.nih.gov/29566439/,Comparison of two melphalan protocols and evaluation of outcome and prognostic factors in multiple myeloma in dogs,J Vet Intern Med 2018,2026-07-22,文獻稽核(agent 查 PubMed/獸醫指引),case_series,SUPPORTED,文獻稽核(pet_labels_provenance.csv),https://pubmed.ncbi.nlm.nih.gov/29566439/,[Evidence欄:標準犬多發性骨髓瘤] Melphalan is the established chemotherapy backbone for canine multiple myeloma (median survival 930 d here; also Matus PMID 3721983). | 橋接:EQUIVALENT
drug_disease_label,associations/Kdataset.csv,731(DB00361),472(D002289),"melphalan → Carcinoma, Non-Small-Cell Lung",data-v3 (擴充),—(文獻/指引),Vet Sci 2023 (Vinorelbine as First-Line Treatment in Stage IV Canine Primary Pulmonary Carcinoma),38133215,,,,D002289,DB00361,https://pmc.ncbi.nlm.nih.gov/articles/PMC10747721/,,Vet Sci 2023 (Vinorelbine as First-Line Treatment in Stage IV Canine Primary Pulmonary Carcinoma),2026-07-22,PubMed/獸醫指引檢索(agent);PMID 經 eutils esummary 驗證,prospective_trial,SUPPORTED,NCBI E-utilities (PMID) + PubChem/PrimeKG (DrugBank ID),https://pubmed.ncbi.nlm.nih.gov/38133215/,[Evidence欄:PMID:38133215] Vinorelbine used first-line for canine primary pulmonary (non-small-cell) carcinoma; 8/10 stage IV dogs achieved partial response (median TTP 88 d). N | 橋接:ANALOGOUS
drug_disease_label,associations/Kdataset.csv,77(DB00783),454(D064726),DB00783 → Triple Negative Breast Neoplasms,data-v2 (TNBC),ChEMBL drug_indication (mesh_id=D064726),ClinicalTrials.gov NCT03941730,,,NCT03941730,CHEMBL135,D064726,DB00783,https://www.ebi.ac.uk/chembl/compound_report_card/CHEMBL135/,"Estradiol in Treating Patients With ER Beta Positive, Triple Negative Locally Advanced or ",,2026-07-22,GET ebi.ac.uk/chembl/api/data/drug_indication?mesh_id=D064726 | GET clinicaltrials.gov/api/v2/studies?query.cond=triple+negative+breast+cancer&query.intr=estradiol,clinical_phase_2,SUPPORTED,PubChem PUG REST (ID) + ClinicalTrials.gov API v2 (交叉驗),https://clinicaltrials.gov/study/NCT03941730,[Evidence欄:ChEMBL-p2|NCT03941730] ChEMBL max_phase 2;CT.gov 10 個試驗
drug_disease_label,associations/Kdataset.csv,78(DB01204),463(D054198),mitoxantrone → Precursor Cell Lymphoblastic Leukemia-Lymphoma,data-v1 (策展) → 稽核保留,"—(人工策展,原始無引用)",,9773407,10.1111/j.1939-1676.1998.tb02130.x,,,D054198,DB01204,https://pubmed.ncbi.nlm.nih.gov/9773407/,Evaluation of single-agent mitoxantrone as chemotherapy for relapsing canine lymphoma,J Vet Intern Med 1998,2026-07-22,文獻稽核(agent 查 PubMed/獸醫指引),case_series,SUPPORTED,文獻稽核(pet_labels_provenance.csv),https://pubmed.ncbi.nlm.nih.gov/9773407/,[Evidence欄:標準] Genuine canine lymphoma agent but the authors concluded single-agent mitoxantrone has 'limited value' at 1st relapse; it is an alternative to doxorubi | 橋接:ANALOGOUS
drug_disease_label,associations/Kdataset.csv,78(DB01204),474(D001749),mitoxantrone → Urinary Bladder Neoplasms,data-v1 (策展) → 稽核保留,"—(人工策展,原始無引用)",,25619518,10.1111/jvim.12533,,,D001749,DB01204,https://pubmed.ncbi.nlm.nih.gov/25619518/,Randomized phase III trial of piroxicam in combination with mitoxantrone or carboplatin for first-line treatment of urogenital tract transitional cell carcinoma in dogs,J Vet Intern Med 2015,2026-07-22,文獻稽核(agent 查 PubMed/獸醫指引),RCT,SUPPORTED,文獻稽核(pet_labels_provenance.csv),https://pubmed.ncbi.nlm.nih.gov/25619518/,"[Evidence欄:標準] Randomized phase III first-line trial; mitoxantrone plus piroxicam is an accepted first-line protocol for canine bladder TCC (also PMID 12576466, Clin | 橋接:ANALOGOUS"
drug_disease_label,associations/Kdataset.csv,80(DB01037),488(D003480),DB01037 → Cushing Syndrome,data-v3 (擴充),—(文獻/指引),Vet Clin North Am 1997 (Bruyette et al.),9076907,,,,D003480,DB01037,https://pubmed.ncbi.nlm.nih.gov/9076907/,,Vet Clin North Am 1997 (Bruyette et al.),2026-07-22,PubMed/獸醫指引檢索(agent);PMID 經 eutils esummary 驗證,prospective_trial,SUPPORTED,NCBI E-utilities (PMID) + PubChem/PrimeKG (DrugBank ID),https://pubmed.ncbi.nlm.nih.gov/9076907/,"[Evidence欄:PMID:9076907] Selegiline (l-deprenyl, Anipryl) is the only FDA-approved drug for canine pituitary-dependent hyperadrenocorticism; clinical/endocrinologic improvemen | 橋接:EQUIVALENT"
drug_disease_label,associations/Kdataset.csv,801(DB00284),462(D003924),"DB00284 → Diabetes Mellitus, Type 2",data-v3 (擴充),—(文獻/指引),J Feline Med Surg 2003 (Mazzaferro et al),12765629,,,,D003924,DB00284,https://pubmed.ncbi.nlm.nih.gov/12765629/,,J Feline Med Surg 2003 (Mazzaferro et al),2026-07-22,PubMed/獸醫指引檢索(agent);PMID 經 eutils esummary 驗證,prospective_trial,SUPPORTED,NCBI E-utilities (PMID) + PubChem/PrimeKG (DrugBank ID),https://pubmed.ncbi.nlm.nih.gov/12765629/,[Evidence欄:PMID:12765629] Clinical study of client-owned diabetic cats: the alpha-glucosidase inhibitor acarbose 12.5 mg/cat PO q12h with a low-carbohydrate diet improved glyce | 橋接:ANALOGOUS
drug_disease_label,associations/Kdataset.csv,821(DB08828),454(D064726),DB08828 → Triple Negative Breast Neoplasms,data-v2 (TNBC),ChEMBL drug_indication (mesh_id=D064726),ClinicalTrials.gov NCT01071564,,,NCT01071564,CHEMBL473417,D064726,DB08828,https://www.ebi.ac.uk/chembl/compound_report_card/CHEMBL473417/,RO4929097 and Vismodegib in Treating Patients With Breast Cancer That is Metastatic or Can,,2026-07-22,GET ebi.ac.uk/chembl/api/data/drug_indication?mesh_id=D064726 | GET clinicaltrials.gov/api/v2/studies?query.cond=triple+negative+breast+cancer&query.intr=vismodegib,clinical_phase_1,SUPPORTED,PubChem PUG REST (ID) + ClinicalTrials.gov API v2 (交叉驗),https://clinicaltrials.gov/study/NCT01071564,[Evidence欄:ChEMBL-p1|NCT01071564] ChEMBL max_phase 1;CT.gov 2 個試驗
drug_disease_label,associations/Kdataset.csv,83(DB01174),479(D020190),"phenobarbital → Myoclonic Epilepsy, Juvenile",data-v1 (策展) → 稽核保留,"—(人工策展,原始無引用)",,26899355,10.1111/jvim.13841,,,D020190,DB01174,https://pmc.ncbi.nlm.nih.gov/articles/PMC4913615/,2015 ACVIM Small Animal Consensus Statement on Seizure Management in Dogs,J Vet Intern Med 2016,2026-07-22,文獻稽核(agent 查 PubMed/獸醫指引),guideline,SUPPORTED,文獻稽核(pet_labels_provenance.csv),https://pubmed.ncbi.nlm.nih.gov/26899355/,[Evidence欄:標準犬癲癇] Phenobarbital is Level I/Grade A first-line monotherapy for canine epilepsy generally; it was among the AEDs used in the 21 Rhodesian Ridgeback juveni | 橋接:ANALOGOUS
drug_disease_label,associations/Kdataset.csv,84(DB01202),479(D020190),"levetiracetam → Myoclonic Epilepsy, Juvenile",data-v1 (策展) → 稽核保留,"—(人工策展,原始無引用)",,29194766,10.1111/jvim.14892,,,D020190,DB01202,https://pmc.ncbi.nlm.nih.gov/articles/PMC5787207/,Absence Seizures as a Feature of Juvenile Myoclonic Epilepsy in Rhodesian Ridgeback Dogs,J Vet Intern Med 2018,2026-07-22,文獻稽核(agent 查 PubMed/獸醫指引),case_series,SUPPORTED,文獻稽核(pet_labels_provenance.csv),https://pubmed.ncbi.nlm.nih.gov/29194766/,"[Evidence欄:標準] Disease-specific match: canine JME (DIRAS1, Rhodesian Ridgeback); levetiracetam gave 97.2% EEG-confirmed myoclonic seizure reduction and abolished abs | 橋接:ANALOGOUS"
drug_disease_label,associations/Kdataset.csv,85(DB01070),480(D007011),DB01070 → Hypoparathyroidism,data-v3 (擴充),—(文獻/指引),Merck Vet Manual (Hypoparathyroidism in Dogs),,,,,D007011,DB01070,https://www.merckvetmanual.com/musculoskeletal-system/dystrophies-associated-with-calcium-phosphorus-and-vitamin-d/hypoparathyroidism-in-dogs,,Merck Vet Manual (Hypoparathyroidism in Dogs),2026-07-22,PubMed/獸醫指引檢索(agent);PMID 經 eutils esummary 驗證,review,SUPPORTED,NCBI E-utilities (PMID) + PubChem/PrimeKG (DrugBank ID),https://www.merckvetmanual.com/musculoskeletal-system/dystrophies-associated-with-calcium-phosphorus-and-vitamin-d/hypoparathyroidism-in-dogs,[Evidence欄:Merck Vet Manual (Hypoparath] Merck Vet Manual lists dihydrotachysterol as a rapid-onset vitamin D analogue for maintaining serum calcium in dogs/cats with hypoparathyroidism. | 橋接:EQUIVALENT
drug_disease_label,associations/Kdataset.csv,854(DB09031),493(D007896),DB09031 → Leishmaniasis,data-v3 (擴充),—(文獻/指引),LeishVet guidelines 2011 (Solano-Gallego et al); WAVD consensus 2025,21599936,,,,D007896,DB09031,https://parasitesandvectors.biomedcentral.com/articles/10.1186/1756-3305-4-86,,LeishVet guidelines 2011 (Solano-Gallego et al); WAVD consensus 2025,2026-07-22,PubMed/獸醫指引檢索(agent);PMID 經 eutils esummary 驗證,guideline,SUPPORTED,NCBI E-utilities (PMID) + PubChem/PrimeKG (DrugBank ID),https://pubmed.ncbi.nlm.nih.gov/21599936/,[Evidence欄:PMID:21599936] Miltefosine (2 mg/kg PO q24h x28d) combined with allopurinol is a recommended first-line leishmanicidal protocol for canine leishmaniosis in the Leish | 橋接:EQUIVALENT
drug_disease_label,associations/Kdataset.csv,876(DB00995),482(D012516),auranofin → Osteosarcoma,data-v1 (策展) → 稽核保留,"—(人工策展,原始無引用)",,31441983,10.1111/vco.12533,,,D012516,DB00995,https://onlinelibrary.wiley.com/doi/abs/10.1111/vco.12533,Auranofin improves overall survival when combined with standard of care in a pilot study involving dogs with osteosarcoma,Vet Comp Oncol 2020,2026-07-22,文獻稽核(agent 查 PubMed/獸醫指引),prospective_trial,SUPPORTED,文獻稽核(pet_labels_provenance.csv),https://pubmed.ncbi.nlm.nih.gov/31441983/,"[Evidence欄:重定位] Single-arm multicentre pilot (40 dogs, historical control n=26) adding auranofin (an antirheumatic gold drug) to amputation+carboplatin; survival bene | 橋接:EQUIVALENT"
drug_disease_label,associations/Kdataset.csv,880(DB00390),481(D006333),digoxin → Heart Failure,data-v1 (策展) → 稽核保留,"—(人工策展,原始無引用)",,30974015,10.1111/jvim.15488,,,D006333,DB00390,https://academic.oup.com/jvim/article/33/3/1127/8448111,ACVIM consensus guidelines for the diagnosis and treatment of myxomatous mitral valve disease in dogs,J Vet Intern Med 2019,2026-07-22,文獻稽核(agent 查 PubMed/獸醫指引),guideline,SUPPORTED,文獻稽核(pet_labels_provenance.csv),https://pubmed.ncbi.nlm.nih.gov/30974015/,"[Evidence欄:標準] Guideline recommends digoxin in Stage C heart failure ONLY when complicated by persistent atrial fibrillation, to slow ventricular rate — it is not st | 橋接:ANALOGOUS"
drug_disease_label,associations/Kdataset.csv,889(DB00642),454(D064726),DB00642 → Triple Negative Breast Neoplasms,data-v2 (TNBC),ChEMBL drug_indication (mesh_id=D064726),ClinicalTrials.gov NCT07191405,,,NCT07191405,CHEMBL225072,D064726,DB00642,https://www.ebi.ac.uk/chembl/compound_report_card/CHEMBL225072/,Clinical Study of Chemotherapy and Immunotherapy Combined With Lactobacillus Johnsonii in ,,2026-07-22,GET ebi.ac.uk/chembl/api/data/drug_indication?mesh_id=D064726 | GET clinicaltrials.gov/api/v2/studies?query.cond=triple+negative+breast+cancer&query.intr=pemetrexed,clinical_phase_1,SUPPORTED,PubChem PUG REST (ID) + ClinicalTrials.gov API v2 (交叉驗),https://clinicaltrials.gov/study/NCT07191405,[Evidence欄:ChEMBL-p1|NCT07191405] ChEMBL max_phase 1;CT.gov 7 個試驗
drug_disease_label,associations/Kdataset.csv,92(DB00153),480(D007011),DB00153 → Hypoparathyroidism,data-v3 (擴充),—(文獻/指引),Merck Vet Manual (Hypoparathyroidism in Dogs),,,,,D007011,DB00153,https://www.merckvetmanual.com/musculoskeletal-system/dystrophies-associated-with-calcium-phosphorus-and-vitamin-d/hypoparathyroidism-in-dogs,,Merck Vet Manual (Hypoparathyroidism in Dogs),2026-07-22,PubMed/獸醫指引檢索(agent);PMID 經 eutils esummary 驗證,review,SUPPORTED,NCBI E-utilities (PMID) + PubChem/PrimeKG (DrugBank ID),https://www.merckvetmanual.com/musculoskeletal-system/dystrophies-associated-with-calcium-phosphorus-and-vitamin-d/hypoparathyroidism-in-dogs,[Evidence欄:Merck Vet Manual (Hypoparath] Merck Vet Manual gives ergocalciferol (vitamin D2) loading/maintenance dosing for hypoparathyroidism in dogs and cats. | 橋接:EQUIVALENT
drug_disease_label,associations/Kdataset.csv,96(DB01263),477(D001228),DB01263 → Aspergillosis,data-v3 (擴充),—(文獻/指引),"JVIM 2016 (Corrigan et al., 10 dogs)",,,,,D001228,DB01263,https://onlinelibrary.wiley.com/doi/10.1111/jvim.13795,,"JVIM 2016 (Corrigan et al., 10 dogs)",2026-07-22,PubMed/獸醫指引檢索(agent);PMID 經 eutils esummary 驗證,case_series,SUPPORTED,NCBI E-utilities (PMID) + PubChem/PrimeKG (DrugBank ID),https://onlinelibrary.wiley.com/doi/10.1111/jvim.13795,"[Evidence欄:JVIM 2016 (Corrigan et al., ] Corrigan et al. 2016 JVIM case series treated 10 dogs with disseminated aspergillosis using posaconazole. | 橋接:ANALOGOUS"
drug_disease_label,associations/Kdataset.csv,97(DB00381),455(D006973),amlodipine → Hypertension,data-v1 (策展) → 稽核保留,"—(人工策展,原始無引用)",,30353952,10.1111/jvim.15331,,,D006973,DB00381,https://pmc.ncbi.nlm.nih.gov/articles/PMC6271319/,"ACVIM consensus statement: Guidelines for the identification, evaluation, and management of systemic hypertension in dogs and cats",J Vet Intern Med 2018,2026-07-22,文獻稽核(agent 查 PubMed/獸醫指引),guideline,SUPPORTED,文獻稽核(pet_labels_provenance.csv),https://pubmed.ncbi.nlm.nih.gov/30353952/,[Evidence欄:標準貓高血壓] ACVIM consensus explicitly states amlodipine besylate is the first-choice antihypertensive in cats; supporting RCTs also exist. | 橋接:ANALOGOUS
drug_disease_label,associations/Kdataset.csv,99(DB01211),487(D009165),"clarithromycin → Mycobacterium Infections, Nontuberculous",data-v1 (策展) → 稽核保留,"—(人工策展,原始無引用)",,23813823,10.1177/1098612X13489221,,,D009165,DB01211,https://pmc.ncbi.nlm.nih.gov/articles/PMC11148952/,Mycobacterioses in Cats: ABCD guidelines on prevention and management,J Feline Med Surg 2013;15(7):591-597,2026-07-22,文獻稽核(agent 查 PubMed/獸醫指引),guideline,SUPPORTED,文獻稽核(pet_labels_provenance.csv),https://pubmed.ncbi.nlm.nih.gov/23813823/,[Evidence欄:標準分枝桿菌] ABCD (European Advisory Board on Cat Diseases) guideline recommends 'clarithromycin 125 mg/cat q24h ... for 6-9 months' as part of 2-3 drug combinatio | 橋接:EQUIVALENT
disease_bridge,interactions/disease_disease.csv,455(D006973),1(D006973),Hypertension ↔ 人類 Hypertension (Sim=1.0),KPet(人工建立:同名複製),MeSH (NLM) — 同一個 MeSH descriptor,"ACVIM consensus statement 2018 (Acierno et al., J Vet Intern Med 32:1803-1822)",30353952,,,,D006973,,https://pmc.ncbi.nlm.nih.gov/articles/PMC6271319/,,"ACVIM consensus statement 2018 (Acierno et al., J Vet Intern Med 32:1803-1822)",2026-07-22,人工建立(Sim=1.0 同名複製);事後查證見 pet_bridges_provenance.csv,,ANALOGOUS,跨物種病種查證(pet_bridges_provenance.csv),https://pubmed.ncbi.nlm.nih.gov/30353952/,"Sim=1.0 站得住:False | In dogs and cats hypertension is predominantly SECONDARY to an identifiable underlying disease, with idiopathic hyperten"
disease_bridge,interactions/disease_disease.csv,456(D001249),2(D001249),Asthma ↔ 人類 Asthma (Sim=1.0),KPet(人工建立:同名複製),MeSH (NLM) — 同一個 MeSH descriptor,"MSD/Merck Vet Manual, Feline Bronchial Asthma",,,,,D001249,,https://www.merckvetmanual.com/respiratory-system/respiratory-diseases-of-small-animals/feline-bronchial-asthma,,"MSD/Merck Vet Manual, Feline Bronchial Asthma",2026-07-22,人工建立(Sim=1.0 同名複製);事後查證見 pet_bridges_provenance.csv,,EQUIVALENT,跨物種病種查證(pet_bridges_provenance.csv),https://www.merckvetmanual.com/respiratory-system/respiratory-diseases-of-small-animals/feline-bronchial-asthma,Sim=1.0 站得住:True | 
disease_bridge,interactions/disease_disease.csv,457(D003876),3(D003876),"Dermatitis, Atopic ↔ 人類 Dermatitis, Atopic (Sim=1.0)",KPet(人工建立:同名複製),MeSH (NLM) — 同一個 MeSH descriptor,"ICADA 2023 updated definition (Eisenschenk et al., Vet Dermatol 2024;35(1):3-4, doi:10.1111/vde.13183)",,,,,D003876,,https://onlinelibrary.wiley.com/doi/10.1111/vde.13183,,"ICADA 2023 updated definition (Eisenschenk et al., Vet Dermatol 2024;35(1):3-4, doi:10.1111/vde.13183)",2026-07-22,人工建立(Sim=1.0 同名複製);事後查證見 pet_bridges_provenance.csv,,EQUIVALENT,跨物種病種查證(pet_bridges_provenance.csv),https://onlinelibrary.wiley.com/doi/10.1111/vde.13183,Sim=1.0 站得住:True | 
disease_bridge,interactions/disease_disease.csv,458(D001943),4(D001943),Breast Neoplasms ↔ 人類 Breast Neoplasms (Sim=1.0),KPet(人工建立:同名複製),MeSH (NLM) — 同一個 MeSH descriptor,"Razavirad et al., 'Canine Mammary Tumors as a Potential Model for Human Breast Cancer in Comparative Oncology', Vet Med Int 2024",,,,,D001943,,https://www.ncbi.nlm.nih.gov/pmc/articles/PMC11101259/,,"Razavirad et al., 'Canine Mammary Tumors as a Potential Model for Human Breast Cancer in Comparative Oncology', Vet Med Int 2024",2026-07-22,人工建立(Sim=1.0 同名複製);事後查證見 pet_bridges_provenance.csv,,ANALOGOUS,跨物種病種查證(pet_bridges_provenance.csv),https://www.ncbi.nlm.nih.gov/pmc/articles/PMC11101259/,Sim=1.0 站得住:False | Roughly half of canine mammary tumours are benign and mixed (myoepithelial-containing) tumours are the single most commo
disease_bridge,interactions/disease_disease.csv,459(D001932),5(D001932),Brain Neoplasms ↔ 人類 Brain Neoplasms (Sim=1.0),KPet(人工建立:同名複製),MeSH (NLM) — 同一個 MeSH descriptor,"'Canine Primary Intracranial Cancer: A Clinicopathologic and Comparative Review of Glioma, Meningioma, and Choroid Plexus Tumors' (PMC6856054)",,,,,D001932,,https://pmc.ncbi.nlm.nih.gov/articles/PMC6856054/,,"'Canine Primary Intracranial Cancer: A Clinicopathologic and Comparative Review of Glioma, Meningioma, and Choroid Plexus Tumors' (PMC6856054)",2026-07-22,人工建立(Sim=1.0 同名複製);事後查證見 pet_bridges_provenance.csv,,EQUIVALENT,跨物種病種查證(pet_bridges_provenance.csv),https://pmc.ncbi.nlm.nih.gov/articles/PMC6856054/,Sim=1.0 站得住:True | 
disease_bridge,interactions/disease_disease.csv,460(D010003),8(D010003),Osteoarthritis ↔ 人類 Osteoarthritis (Sim=1.0),KPet(人工建立:同名複製),MeSH (NLM) — 同一個 MeSH descriptor,"'Spontaneous dog osteoarthritis - a One Medicine vision', Nature Reviews Rheumatology 2019 (PMC7097182)",,,,,D010003,,https://pmc.ncbi.nlm.nih.gov/articles/PMC7097182/,,"'Spontaneous dog osteoarthritis - a One Medicine vision', Nature Reviews Rheumatology 2019 (PMC7097182)",2026-07-22,人工建立(Sim=1.0 同名複製);事後查證見 pet_bridges_provenance.csv,,EQUIVALENT,跨物種病種查證(pet_bridges_provenance.csv),https://pmc.ncbi.nlm.nih.gov/articles/PMC7097182/,Sim=1.0 站得住:True | 
disease_bridge,interactions/disease_disease.csv,461(D001172),12(D001172),"Arthritis, Rheumatoid ↔ 人類 Arthritis, Rheumatoid (Sim=1.0)",KPet(人工建立:同名複製),MeSH (NLM) — 同一個 MeSH descriptor,"MSD/Merck Vet Manual, Immune-Mediated Polyarthritis in Dogs and Cats",,,,,D001172,,https://www.merckvetmanual.com/musculoskeletal-system/arthropathies-and-related-disorders-in-small-animals/immune-mediated-polyarthritis-in-dogs-and-cats,,"MSD/Merck Vet Manual, Immune-Mediated Polyarthritis in Dogs and Cats",2026-07-22,人工建立(Sim=1.0 同名複製);事後查證見 pet_bridges_provenance.csv,,ANALOGOUS,跨物種病種查證(pet_bridges_provenance.csv),https://www.merckvetmanual.com/musculoskeletal-system/arthropathies-and-related-disorders-in-small-animals/immune-mediated-polyarthritis-in-dogs-and-cats,Sim=1.0 站得住:False | Canine/feline RA is a RARE erosive subset of immune-mediated polyarthritis - non-erosive IMPA is far more common and is 
