item_type,file,key_a,key_b,label,origin,source_db,source_ref,pmid,doi,nct_id,chembl_id,mesh_id,drugbank_id,source_url,source_title,source_journal_year,retrieved_on,query_used,evidence_level,verdict,verification,ref_url,note
disease_node,omics/disease.csv,454,D064726,Triple Negative Breast Neoplasms,data-v2 (TNBC),NLM MeSH SPARQL,MeSH descriptor D064726,,,,,D064726,,https://id.nlm.nih.gov/mesh/sparql,,,2026-07-22,"SPARQL: SELECT ?d ?label WHERE { ?d a meshv:TopicalDescriptor . ?d rdfs:label ?label . FILTER(CONTAINS(LCASE(?label),""triple negative"")) }",,SUPPORTED,NLM MeSH SPARQL 查得 descriptor,https://meshb.nlm.nih.gov/record/ui?ui=D064726,資料集原本只有籠統的 D001943 Breast Neoplasms
disease_node,omics/disease.csv,455,D006973,寵物-Hypertension,KPet(人工建立),MeSH (NLM) — 沿用橋接人類病的 MeSH,"ACVIM consensus statement 2018 (Acierno et al., J Vet Intern Med 32:1803-1822)",30353952,,,,D006973,,https://pmc.ncbi.nlm.nih.gov/articles/PMC6271319/,,"ACVIM consensus statement 2018 (Acierno et al., J Vet Intern Med 32:1803-1822)",2026-07-22,人工建立(同名複製人類病);事後經 agent 查證跨物種病種是否等價,,ANALOGOUS,跨物種病種查證(pet_bridges_provenance.csv),https://pubmed.ncbi.nlm.nih.gov/30353952/,"In dogs and cats hypertension is predominantly SECONDARY to an identifiable underlying disease, with idiopathic hypertension accounting for only ~13-2"
disease_node,omics/disease.csv,456,D001249,寵物-Asthma,KPet(人工建立),MeSH (NLM) — 沿用橋接人類病的 MeSH,"MSD/Merck Vet Manual, Feline Bronchial Asthma",,,,,D001249,,https://www.merckvetmanual.com/respiratory-system/respiratory-diseases-of-small-animals/feline-bronchial-asthma,,"MSD/Merck Vet Manual, Feline Bronchial Asthma",2026-07-22,人工建立(同名複製人類病);事後經 agent 查證跨物種病種是否等價,,EQUIVALENT,跨物種病種查證(pet_bridges_provenance.csv),https://www.merckvetmanual.com/respiratory-system/respiratory-diseases-of-small-animals/feline-bronchial-asthma,
disease_node,omics/disease.csv,457,D003876,"寵物-Dermatitis, Atopic",KPet(人工建立),MeSH (NLM) — 沿用橋接人類病的 MeSH,"ICADA 2023 updated definition (Eisenschenk et al., Vet Dermatol 2024;35(1):3-4, doi:10.1111/vde.13183)",,,,,D003876,,https://onlinelibrary.wiley.com/doi/10.1111/vde.13183,,"ICADA 2023 updated definition (Eisenschenk et al., Vet Dermatol 2024;35(1):3-4, doi:10.1111/vde.13183)",2026-07-22,人工建立(同名複製人類病);事後經 agent 查證跨物種病種是否等價,,EQUIVALENT,跨物種病種查證(pet_bridges_provenance.csv),https://onlinelibrary.wiley.com/doi/10.1111/vde.13183,
disease_node,omics/disease.csv,458,D001943,寵物-Breast Neoplasms,KPet(人工建立),MeSH (NLM) — 沿用橋接人類病的 MeSH,"Razavirad et al., 'Canine Mammary Tumors as a Potential Model for Human Breast Cancer in Comparative Oncology', Vet Med Int 2024",,,,,D001943,,https://www.ncbi.nlm.nih.gov/pmc/articles/PMC11101259/,,"Razavirad et al., 'Canine Mammary Tumors as a Potential Model for Human Breast Cancer in Comparative Oncology', Vet Med Int 2024",2026-07-22,人工建立(同名複製人類病);事後經 agent 查證跨物種病種是否等價,,ANALOGOUS,跨物種病種查證(pet_bridges_provenance.csv),https://www.ncbi.nlm.nih.gov/pmc/articles/PMC11101259/,Roughly half of canine mammary tumours are benign and mixed (myoepithelial-containing) tumours are the single most common canine type despite being ra
disease_node,omics/disease.csv,459,D001932,寵物-Brain Neoplasms,KPet(人工建立),MeSH (NLM) — 沿用橋接人類病的 MeSH,"'Canine Primary Intracranial Cancer: A Clinicopathologic and Comparative Review of Glioma, Meningioma, and Choroid Plexus Tumors' (PMC6856054)",,,,,D001932,,https://pmc.ncbi.nlm.nih.gov/articles/PMC6856054/,,"'Canine Primary Intracranial Cancer: A Clinicopathologic and Comparative Review of Glioma, Meningioma, and Choroid Plexus Tumors' (PMC6856054)",2026-07-22,人工建立(同名複製人類病);事後經 agent 查證跨物種病種是否等價,,EQUIVALENT,跨物種病種查證(pet_bridges_provenance.csv),https://pmc.ncbi.nlm.nih.gov/articles/PMC6856054/,
disease_node,omics/disease.csv,460,D010003,寵物-Osteoarthritis,KPet(人工建立),MeSH (NLM) — 沿用橋接人類病的 MeSH,"'Spontaneous dog osteoarthritis - a One Medicine vision', Nature Reviews Rheumatology 2019 (PMC7097182)",,,,,D010003,,https://pmc.ncbi.nlm.nih.gov/articles/PMC7097182/,,"'Spontaneous dog osteoarthritis - a One Medicine vision', Nature Reviews Rheumatology 2019 (PMC7097182)",2026-07-22,人工建立(同名複製人類病);事後經 agent 查證跨物種病種是否等價,,EQUIVALENT,跨物種病種查證(pet_bridges_provenance.csv),https://pmc.ncbi.nlm.nih.gov/articles/PMC7097182/,
disease_node,omics/disease.csv,461,D001172,"寵物-Arthritis, Rheumatoid",KPet(人工建立),MeSH (NLM) — 沿用橋接人類病的 MeSH,"MSD/Merck Vet Manual, Immune-Mediated Polyarthritis in Dogs and Cats",,,,,D001172,,https://www.merckvetmanual.com/musculoskeletal-system/arthropathies-and-related-disorders-in-small-animals/immune-mediated-polyarthritis-in-dogs-and-cats,,"MSD/Merck Vet Manual, Immune-Mediated Polyarthritis in Dogs and Cats",2026-07-22,人工建立(同名複製人類病);事後經 agent 查證跨物種病種是否等價,,ANALOGOUS,跨物種病種查證(pet_bridges_provenance.csv),https://www.merckvetmanual.com/musculoskeletal-system/arthropathies-and-related-disorders-in-small-animals/immune-mediated-polyarthritis-in-dogs-and-cats,Canine/feline RA is a RARE erosive subset of immune-mediated polyarthritis - non-erosive IMPA is far more common and is the disease usually being trea
disease_node,omics/disease.csv,462,D003924,"寵物-Diabetes Mellitus, Type 2",KPet(人工建立),MeSH (NLM) — 沿用橋接人類病的 MeSH,"'Comparative Pharmacological and Pharmaceutical Perspectives on Antidiabetic Therapies in Humans, Dogs, and Cats' (PMC12472474); also Henson & O'Brien, ILAR J 2006;47(3):234, 'Feline Models of Type 2 Diabetes Mellitus'",,,,,D003924,,https://pmc.ncbi.nlm.nih.gov/articles/PMC12472474/,,"'Comparative Pharmacological and Pharmaceutical Perspectives on Antidiabetic Therapies in Humans, Dogs, and Cats' (PMC12472474); also Henson & O'Brien, ILAR J 2006;47(3):234, 'Feline Models of Type 2 Diabetes Mellitus'",2026-07-22,人工建立(同名複製人類病);事後經 agent 查證跨物種病種是否等價,,ANALOGOUS,跨物種病種查證(pet_bridges_provenance.csv),https://pmc.ncbi.nlm.nih.gov/articles/PMC12472474/,"Type 2 diabetes is genuinely feline-only among pets - cats show insulin resistance, obesity and islet amyloidosis with IAPP differing from human by on"
disease_node,omics/disease.csv,463,D054198,寵物-Precursor Cell Lymphoblastic Leukemia-Lymphoma,KPet(人工建立),MeSH (NLM) — 沿用橋接人類病的 MeSH,"Avery AC, 'The Genetic and Molecular Basis for Canine Models of Human Leukemia and Lymphoma', Front Oncol 2020;10:23",32038991,,,,D054198,,https://pmc.ncbi.nlm.nih.gov/articles/PMC6992561/,,"Avery AC, 'The Genetic and Molecular Basis for Canine Models of Human Leukemia and Lymphoma', Front Oncol 2020;10:23",2026-07-22,人工建立(同名複製人類病);事後經 agent 查證跨物種病種是否等價,,ANALOGOUS,跨物種病種查證(pet_bridges_provenance.csv),https://pubmed.ncbi.nlm.nih.gov/32038991/,"Canine ALL is almost always T-cell in origin, arises in middle-aged/older dogs (median 7-8 years) and is near-uniformly fatal (median survival 25-50 d"
disease_node,omics/disease.csv,464,D015470,"寵物-Leukemia, Myeloid, Acute",KPet(人工建立),MeSH (NLM) — 沿用橋接人類病的 MeSH,"Vet Clin Pathol 1991, 'Proposed criteria for classification of acute myeloid leukemia in dogs and cats' (human FAB/NCI criteria adapted)",12673541,,,,D015470,,https://pubmed.ncbi.nlm.nih.gov/12673541/,,"Vet Clin Pathol 1991, 'Proposed criteria for classification of acute myeloid leukemia in dogs and cats' (human FAB/NCI criteria adapted)",2026-07-22,人工建立(同名複製人類病);事後經 agent 查證跨物種病種是否等價,,EQUIVALENT,跨物種病種查證(pet_bridges_provenance.csv),https://pubmed.ncbi.nlm.nih.gov/12673541/,
disease_node,omics/disease.csv,465,D009101,寵物-Multiple Myeloma,KPet(人工建立),MeSH (NLM) — 沿用橋接人類病的 MeSH,"MSD Vet Manual, 'Gammopathies in Animals'",,,,,D009101,,https://www.msdvetmanual.com/immune-system/immunologic-diseases/gammopathies-in-animals,,"MSD Vet Manual, 'Gammopathies in Animals'",2026-07-22,人工建立(同名複製人類病);事後經 agent 查證跨物種病種是否等價,,EQUIVALENT,跨物種病種查證(pet_bridges_provenance.csv),https://www.msdvetmanual.com/immune-system/immunologic-diseases/gammopathies-in-animals,
disease_node,omics/disease.csv,466,D010437,寵物-Peptic Ulcer,KPet(人工建立),MeSH (NLM) — 沿用橋接人類病的 MeSH,"MSD Vet Manual, 'Gastrointestinal Ulcers in Small Animals'",,,,,D010437,,https://www.msdvetmanual.com/digestive-system/diseases-of-the-stomach-in-small-animals/gastrointestinal-ulcers-in-small-animals,,"MSD Vet Manual, 'Gastrointestinal Ulcers in Small Animals'",2026-07-22,人工建立(同名複製人類病);事後經 agent 查證跨物種病種是否等價,,ANALOGOUS,跨物種病種查證(pet_bridges_provenance.csv),https://www.msdvetmanual.com/digestive-system/diseases-of-the-stomach-in-small-animals/gastrointestinal-ulcers-in-small-animals,"Human peptic ulcer is dominated by Helicobacter pylori plus NSAIDs, whereas canine/feline gastroduodenal ulcers are attributed to NSAIDs/glucocorticoi"
disease_node,omics/disease.csv,467,D005902,"寵物-Glaucoma, Open-Angle",KPet(人工建立),MeSH (NLM) — 沿用橋接人類病的 MeSH,"MSD Vet Manual, 'Glaucoma in Animals'",,,,,D005902,,https://www.msdvetmanual.com/eye-diseases-and-disorders/ophthalmology/glaucoma-in-animals,,"MSD Vet Manual, 'Glaucoma in Animals'",2026-07-22,人工建立(同名複製人類病);事後經 agent 查證跨物種病種是否等價,,ANALOGOUS,跨物種病種查證(pet_bridges_provenance.csv),https://www.msdvetmanual.com/eye-diseases-and-disorders/ophthalmology/glaucoma-in-animals,"Canine POAG is a rare early-onset monogenic recessive disease of a few breeds (Beagle and Norwegian Elkhound via ADAMTS10, Basset Hound via ADAMTS17) "
disease_node,omics/disease.csv,468,D008178,"寵物-Lupus Erythematosus, Cutaneous",KPet(人工建立),MeSH (NLM) — 沿用橋接人類病的 MeSH,"BMC Vet Res 2018, 'Cutaneous lupus erythematosus in dogs: a comprehensive review'",29669547,,,,D008178,,https://pubmed.ncbi.nlm.nih.gov/29669547/,,"BMC Vet Res 2018, 'Cutaneous lupus erythematosus in dogs: a comprehensive review'",2026-07-22,人工建立(同名複製人類病);事後經 agent 查證跨物種病種是否等價,,ANALOGOUS,跨物種病種查證(pet_bridges_provenance.csv),https://pubmed.ncbi.nlm.nih.gov/29669547/,Canine CLE variants only partly map onto the human Gilliam-Sontheimer scheme -- some appear unique to the dog -- and canine facial discoid LE essentia
disease_node,omics/disease.csv,469,D015179,寵物-Colorectal Neoplasms,KPet(人工建立),MeSH (NLM) — 沿用橋接人類病的 MeSH,"PLoS One 2012, 'Frequent alteration of the tumor suppressor gene APC in sporadic canine colorectal tumors'",23251390,,,,D015179,,https://pubmed.ncbi.nlm.nih.gov/23251390/,,"PLoS One 2012, 'Frequent alteration of the tumor suppressor gene APC in sporadic canine colorectal tumors'",2026-07-22,人工建立(同名複製人類病);事後經 agent 查證跨物種病種是否等價,,EQUIVALENT,跨物種病種查證(pet_bridges_provenance.csv),https://pubmed.ncbi.nlm.nih.gov/23251390/,
disease_node,omics/disease.csv,470,D002292,"寵物-Carcinoma, Renal Cell",KPet(人工建立),MeSH (NLM) — 沿用橋接人類病的 MeSH,"Vet Pathol 2015, 'Prognostic significance of histologic features in canine renal cell carcinomas: 70 nephrectomies'",24829287,,,,D002292,,https://pubmed.ncbi.nlm.nih.gov/24829287/,,"Vet Pathol 2015, 'Prognostic significance of histologic features in canine renal cell carcinomas: 70 nephrectomies'",2026-07-22,人工建立(同名複製人類病);事後經 agent 查證跨物種病種是否等價,,ANALOGOUS,跨物種病種查證(pet_bridges_provenance.csv),https://pubmed.ncbi.nlm.nih.gov/24829287/,Subtype distribution is inverted -- clear cell RCC is ~75% of human renal carcinomas but only 9% of canine cases (papillary at 21% predominates in dog
disease_node,omics/disease.csv,471,D010392,寵物-Pemphigus,KPet(人工建立),MeSH (NLM) — 沿用橋接人類病的 MeSH,Vet Immunol Immunopathol (canine DSC1 as major PF autoantigen),22884397,,,,D010392,,https://pubmed.ncbi.nlm.nih.gov/22884397/,,Vet Immunol Immunopathol (canine DSC1 as major PF autoantigen),2026-07-22,人工建立(同名複製人類病);事後經 agent 查證跨物種病種是否等價,,ANALOGOUS,跨物種病種查證(pet_bridges_provenance.csv),https://pubmed.ncbi.nlm.nih.gov/22884397/,"The major autoantigen in canine pemphigus foliaceus is desmocollin-1 (DSG1 detected in only ~6% of sera), whereas human pemphigus targets desmoglein-1"
disease_node,omics/disease.csv,472,D002289,"寵物-Carcinoma, Non-Small-Cell Lung",KPet(人工建立),MeSH (NLM) — 沿用橋接人類病的 MeSH,"Front Vet Sci, 'Canine lung carcinoma - A descriptive review'",,,,,D002289,,https://pmc.ncbi.nlm.nih.gov/articles/PMC11788302/,,"Front Vet Sci, 'Canine lung carcinoma - A descriptive review'",2026-07-22,人工建立(同名複製人類病);事後經 agent 查證跨物種病種是否等價,,ANALOGOUS,跨物種病種查證(pet_bridges_provenance.csv),https://pmc.ncbi.nlm.nih.gov/articles/PMC11788302/,No tobacco etiology is recognized in dogs and the driver landscape is inverted -- HER2 mutations in ~38% of canine pulmonary adenocarcinomas vs ~3% in
disease_node,omics/disease.csv,473,D006980,寵物-Hyperthyroidism,KPet(人工建立),MeSH (NLM) — 沿用橋接人類病的 MeSH,"MSD Vet Manual, 'Hyperthyroidism in Animals'",,,,,D006980,,https://www.msdvetmanual.com/endocrine-system/the-thyroid-gland/hyperthyroidism-in-animals,,"MSD Vet Manual, 'Hyperthyroidism in Animals'",2026-07-22,人工建立(同名複製人類病);事後經 agent 查證跨物種病種是否等價,,ANALOGOUS,跨物種病種查證(pet_bridges_provenance.csv),https://www.msdvetmanual.com/endocrine-system/the-thyroid-gland/hyperthyroidism-in-animals,Feline hyperthyroidism is a non-autoimmune autonomous nodular disease (no circulating thyroid-stimulating immunoglobulins) that models human toxic nod
disease_node,omics/disease.csv,474,D001749,寵物-Urinary Bladder Neoplasms,KPet(人工建立),MeSH (NLM) — 沿用橋接人類病的 MeSH,"Front Oncol 2022, naturally-occurring canine model of high grade urothelial carcinoma",,,,,D001749,,https://pmc.ncbi.nlm.nih.gov/articles/PMC9692095/,,"Front Oncol 2022, naturally-occurring canine model of high grade urothelial carcinoma",2026-07-22,人工建立(同名複製人類病);事後經 agent 查證跨物種病種是否等價,,ANALOGOUS,跨物種病種查證(pet_bridges_provenance.csv),https://pmc.ncbi.nlm.nih.gov/articles/PMC9692095/,Canine urothelial carcinoma is >80% high-grade muscle-invasive disease centered on the bladder trigone and carries an activating BRAF V595E mutation i
disease_node,omics/disease.csv,475,D001008,寵物-Anxiety Disorders,KPet(人工建立),MeSH (NLM) — 沿用橋接人類病的 MeSH,"MSD Vet Manual, 'Behavioral Problems of Dogs'",,,,,D001008,,https://www.msdvetmanual.com/behavior/normal-social-behavior-and-behavioral-problems-of-domestic-animals/behavioral-problems-of-dogs,,"MSD Vet Manual, 'Behavioral Problems of Dogs'",2026-07-22,人工建立(同名複製人類病);事後經 agent 查證跨物種病種是否等價,,ANALOGOUS,跨物種病種查證(pet_bridges_provenance.csv),https://www.msdvetmanual.com/behavior/normal-social-behavior-and-behavioral-problems-of-domestic-animals/behavioral-problems-of-dogs,"Canine anxiety is dominated by separation distress and noise phobia, diagnosed purely from observed behavior with no self-reported cognitive component"
disease_node,omics/disease.csv,476,D000744,"寵物-Anemia, Hemolytic, Autoimmune",KPet(人工建立),MeSH (NLM) — 沿用橋接人類病的 MeSH,"ACVIM consensus statement 2019 (Garden et al., diagnosis of IMHA in dogs and cats)",,,,,D000744,,https://onlinelibrary.wiley.com/doi/10.1111/jvim.15441,,"ACVIM consensus statement 2019 (Garden et al., diagnosis of IMHA in dogs and cats)",2026-07-22,人工建立(同名複製人類病);事後經 agent 查證跨物種病種是否等價,,EQUIVALENT,跨物種病種查證(pet_bridges_provenance.csv),https://onlinelibrary.wiley.com/doi/10.1111/jvim.15441,
disease_node,omics/disease.csv,477,D001228,寵物-Aspergillosis,KPet(人工建立),MeSH (NLM) — 沿用橋接人類病的 MeSH,"MSD Vet Manual, 'Aspergillosis in Animals'",,,,,D001228,,https://www.msdvetmanual.com/infectious-diseases/fungal-infections/aspergillosis-in-animals,,"MSD Vet Manual, 'Aspergillosis in Animals'",2026-07-22,人工建立(同名複製人類病);事後經 agent 查證跨物種病種是否等價,,ANALOGOUS,跨物種病種查證(pet_bridges_provenance.csv),https://www.msdvetmanual.com/infectious-diseases/fungal-infections/aspergillosis-in-animals,"Dogs and cats mainly develop fungal rhinosinusitis as immunocompetent hosts (dolichocephalic dogs, A. fumigatus; cats, A. felis), whereas human asperg"
disease_node,omics/disease.csv,478,D000077195,寵物-Squamous Cell Carcinoma of Head and Neck,KPet(人工建立),MeSH (NLM) — 沿用橋接人類病的 MeSH,'Canine Spontaneous Head and Neck Squamous Cell Carcinomas Represent Their Human Counterparts at the Molecular Level',,,,,D000077195,,https://pmc.ncbi.nlm.nih.gov/articles/PMC4452692/,,'Canine Spontaneous Head and Neck Squamous Cell Carcinomas Represent Their Human Counterparts at the Molecular Level',2026-07-22,人工建立(同名複製人類病);事後經 agent 查證跨物種病種是否等價,,ANALOGOUS,跨物種病種查證(pet_bridges_provenance.csv),https://pmc.ncbi.nlm.nih.gov/articles/PMC4452692/,"Canine/feline oral SCC has no true HPV-driven counterpart (it models only HPV-negative HNSCC, while ~25% of human HNSCC is high-risk HPV-associated) a"
disease_node,omics/disease.csv,479,D020190,"寵物-Myoclonic Epilepsy, Juvenile",KPet(人工建立),MeSH (NLM) — 沿用橋接人類病的 MeSH,"PNAS 2017, 'Generalized myoclonic epilepsy with photosensitivity in juvenile dogs caused by a defective DIRAS family GTPase 1'",,,,,D020190,,https://pmc.ncbi.nlm.nih.gov/articles/PMC5347561/,,"PNAS 2017, 'Generalized myoclonic epilepsy with photosensitivity in juvenile dogs caused by a defective DIRAS family GTPase 1'",2026-07-22,人工建立(同名複製人類病);事後經 agent 查證跨物種病種是否等價,,ANALOGOUS,跨物種病種查證(pet_bridges_provenance.csv),https://pmc.ncbi.nlm.nih.gov/articles/PMC5347561/,"Canine JME is a breed-restricted monogenic autosomal-recessive disorder caused by a 4-bp DIRAS1 deletion, whereas human JME shows complex/heterogeneou"
disease_node,omics/disease.csv,480,D007011,寵物-Hypoparathyroidism,KPet(人工建立),MeSH (NLM) — 沿用橋接人類病的 MeSH,MSD Vet Manual,,,,,D007011,,https://www.msdvetmanual.com/musculoskeletal-system/dystrophies-associated-with-calcium-phosphorus-and-vitamin-d/hypoparathyroidism-in-dogs,,MSD Vet Manual,2026-07-22,人工建立(同名複製人類病);事後經 agent 查證跨物種病種是否等價,,EQUIVALENT,跨物種病種查證(pet_bridges_provenance.csv),https://www.msdvetmanual.com/musculoskeletal-system/dystrophies-associated-with-calcium-phosphorus-and-vitamin-d/hypoparathyroidism-in-dogs,
disease_node,omics/disease.csv,481,D006333,寵物-Heart Failure,KPet(人工建立),MeSH (NLM) — 沿用橋接人類病的 MeSH,Merck Vet Manual,,,,,D006333,,https://www.merckvetmanual.com/dog-owners/heart-and-blood-vessel-disorders-of-dogs/heart-failure-in-dogs,,Merck Vet Manual,2026-07-22,人工建立(同名複製人類病);事後經 agent 查證跨物種病種是否等價,,ANALOGOUS,跨物種病種查證(pet_bridges_provenance.csv),https://www.merckvetmanual.com/dog-owners/heart-and-blood-vessel-disorders-of-dogs/heart-failure-in-dogs,"The CHF syndrome itself is real in both species, but the etiologic substrate is fundamentally different: dogs fail from degenerative mitral valve dise"
disease_node,omics/disease.csv,482,D012516,寵物-Osteosarcoma,KPet(人工建立),MeSH (NLM) — 沿用橋接人類病的 MeSH,Front Vet Sci 2022 comparative oncology review,36570509,,,,D012516,,https://pmc.ncbi.nlm.nih.gov/articles/PMC9773846/,,Front Vet Sci 2022 comparative oncology review,2026-07-22,人工建立(同名複製人類病);事後經 agent 查證跨物種病種是否等價,,EQUIVALENT,跨物種病種查證(pet_bridges_provenance.csv),https://pubmed.ncbi.nlm.nih.gov/36570509/,
disease_node,omics/disease.csv,483,D006528,"寵物-Carcinoma, Hepatocellular",KPet(人工建立),MeSH (NLM) — 沿用橋接人類病的 MeSH,"Vet Sci 2022, Comparative Oncology: Management of Hepatic Neoplasia in Humans and Dogs",36136704,,,,D006528,,https://pmc.ncbi.nlm.nih.gov/articles/PMC9505178/,,"Vet Sci 2022, Comparative Oncology: Management of Hepatic Neoplasia in Humans and Dogs",2026-07-22,人工建立(同名複製人類病);事後經 agent 查證跨物種病種是否等價,,ANALOGOUS,跨物種病種查證(pet_bridges_provenance.csv),https://pubmed.ncbi.nlm.nih.gov/36136704/,"Canine HCC lacks the chronic hepatitis B/C and cirrhosis background that drives the majority of human HCC (HBV alone = 55% of cases globally), and pre"
disease_node,omics/disease.csv,484,D018273,"寵物-Carcinoma, Islet Cell",KPet(人工建立),MeSH (NLM) — 沿用橋接人類病的 MeSH,"Transl Oncol 2022, Canine insulinoma as a model for human malignant insulinoma research",34794032,,,,D018273,,https://pubmed.ncbi.nlm.nih.gov/34794032/,,"Transl Oncol 2022, Canine insulinoma as a model for human malignant insulinoma research",2026-07-22,人工建立(同名複製人類病);事後經 agent 查證跨物種病種是否等價,,EQUIVALENT,跨物種病種查證(pet_bridges_provenance.csv),https://pubmed.ncbi.nlm.nih.gov/34794032/,
disease_node,omics/disease.csv,485,D011087,寵物-Polycythemia Vera,KPet(人工建立),MeSH (NLM) — 沿用橋接人類病的 MeSH,"Beurlet et al., Exp Hematol 2011; Merck Vet Manual (Erythrocytosis in Animals)",21320566,,,,D011087,,https://pubmed.ncbi.nlm.nih.gov/21320566/,,"Beurlet et al., Exp Hematol 2011; Merck Vet Manual (Erythrocytosis in Animals)",2026-07-22,人工建立(同名複製人類病);事後經 agent 查證跨物種病種是否等價,,ANALOGOUS,跨物種病種查證(pet_bridges_provenance.csv),https://pubmed.ncbi.nlm.nih.gov/21320566/,"Human PV is defined molecularly by JAK2 V617F in ~95% of cases, whereas canine/feline primary erythrocytosis is essentially a diagnosis of exclusion w"
disease_node,omics/disease.csv,486,D003453,寵物-Cryptococcosis,KPet(人工建立),MeSH (NLM) — 沿用橋接人類病的 MeSH,Merck Vet Manual,,,,,D003453,,https://www.merckvetmanual.com/infectious-diseases/fungal-infections/cryptococcosis-in-animals,,Merck Vet Manual,2026-07-22,人工建立(同名複製人類病);事後經 agent 查證跨物種病種是否等價,,EQUIVALENT,跨物種病種查證(pet_bridges_provenance.csv),https://www.merckvetmanual.com/infectious-diseases/fungal-infections/cryptococcosis-in-animals,
disease_node,omics/disease.csv,487,D009165,"寵物-Mycobacterium Infections, Nontuberculous",KPet(人工建立),MeSH (NLM) — 沿用橋接人類病的 MeSH,Merck Vet Manual; Vet Dermatol 2013 (cutaneous NTM granulomas in cats and dogs),23331691,,,,D009165,,https://www.merckvetmanual.com/generalized-conditions/mycobacterial-infections-in-animals/mycobacterial-infections-in-animals,,Merck Vet Manual; Vet Dermatol 2013 (cutaneous NTM granulomas in cats and dogs),2026-07-22,人工建立(同名複製人類病);事後經 agent 查證跨物種病種是否等價,,EQUIVALENT,跨物種病種查證(pet_bridges_provenance.csv),https://pubmed.ncbi.nlm.nih.gov/23331691/,
disease_node,omics/disease.csv,488,D003480,寵物-Cushing Syndrome,KPet(人工建立),MeSH (NLM) — 沿用橋接人類病的 MeSH,Merck Vet Manual,,,,,D003480,,https://www.merckvetmanual.com/endocrine-system/the-adrenal-glands/cushing-syndrome-hyperadrenocorticism-in-animals,,Merck Vet Manual,2026-07-22,人工建立(同名複製人類病);事後經 agent 查證跨物種病種是否等價,,EQUIVALENT,跨物種病種查證(pet_bridges_provenance.csv),https://www.merckvetmanual.com/endocrine-system/the-adrenal-glands/cushing-syndrome-hyperadrenocorticism-in-animals,
disease_node,omics/disease.csv,489,D002862,寵物-Chromoblastomycosis,KPet(人工建立),MeSH (NLM) — 沿用橋接人類病的 MeSH,J Feline Med Surg 2015 case report; MSD Vet Manual (Phaeohyphomycosis in Animals),25425600,,,,D002862,,https://pubmed.ncbi.nlm.nih.gov/25425600/,,J Feline Med Surg 2015 case report; MSD Vet Manual (Phaeohyphomycosis in Animals),2026-07-22,人工建立(同名複製人類病);事後經 agent 查證跨物種病種是否等價,,ANALOGOUS,跨物種病種查證(pet_bridges_provenance.csv),https://pubmed.ncbi.nlm.nih.gov/25425600/,True chromoblastomycosis (muriform/sclerotic bodies from traumatic inoculation) is essentially absent in dogs/cats and exists only as isolated case re
